date,time,processed,word_count
2020-08-08,16:27:02,intc $ 49c 8 / 28 . atvi $ 54 . 5c 8 / 28 . slv $ 26 . 5c 9 / 18 . wen $ 24c 9 / 18,31
2020-08-08,15:43:40,intc insiders have been buying shares the past couple of weeks .,12
2020-08-07,21:04:32,intel puts are probably a good play right now,9
2020-08-07,19:30:34,"intel confendencial leaks , intel puts ?",7
2020-08-07,19:05:56,intc 8 / 21 50c ... hope for a bounce or cut my losses ?,15
2020-08-07,18:48:47,"intel breached , 20gb posted online with more to come . intel is a dumpster fire , 45p 8 / 14",21
2020-08-07,14:37:27,intel data breach and backdoors leaked,6
2020-08-07,12:57:01,intel has had its source code leaked .,8
2020-08-07,12:06:21,more bad news for intel,5
2020-08-07,07:18:14,hi guys i bought puts for intel how do i make money ?,13
2020-08-07,06:54:12,hi guys i bought put for intel now how do i make money ?,14
2020-08-07,03:26:50,"intel hacked : confidential files , backdoors obtained and leaked by anonymous hacker",13
2020-08-06,23:23:29,who else is holding the bag for intel ?,9
2020-08-06,20:41:37,"short message suggests shorting intel might be a good bet , based off the provided intel .",17
2020-08-06,20:06:24,$ intc ( intel ) - huge internal breach and leaks,11
2020-08-06,19:32:49,fyi intel is going down,5
2020-08-06,18:44:56,reported intel data breach - buy puts boys,8
2020-08-06,18:40:21,"massive 20gb intel data breach floods the internet , mentions backdoors - buy puts boys",15
2020-08-06,18:07:35,intel massive data leak,4
2020-08-06,16:05:36,9 / 4 intc 54 $ calls,7
2020-08-06,15:53:30,now listen i know some of you have way more intc than me -,14
2020-08-06,06:15:38,intc - why you should not hold intel stock long term !,12
2020-08-05,21:15:45,nice . going all in intc 69c . 8 / 7,11
2020-08-05,20:36:05,atvi and intc are getting beat down for no reason,10
2020-08-05,19:58:09,apple shipping latest laptop with intel chip,7
2020-08-05,13:25:33,intc is actually a pretty good deal,7
2020-08-04,23:01:24,bringing my girlfriend to the dark side ( 9 / 4 intc 54 . 50 $ calls got me feelin some type of way ),25
2020-08-04,19:18:52,me still holding 1 . 2k shares of kodak i bought at $ 46 . just sold like 100 shares to buy intel . this literally cannotnot moon . ive said it once . ill say it again . hloding till i d i e .,46
2020-08-04,18:01:33,intel - undervalued and due for pop ( cheap options play ),12
2020-08-04,16:06:14,intel $ 49 . 5 call 9 / 11,9
2020-08-04,15:01:23,intc buy buy buy,4
2020-08-04,10:15:46,"intc about to go to the moon .. and by that i mean that the rocket is made from cardboard and the engineer is the collected braincell from all of wsb . abort mission amigos , intel is only taking off in our dreams any time soon .",48
2020-08-03,23:20:43,plays on intc ?,4
2020-08-03,21:31:34,intc - it cannot go tits up,7
2020-08-03,20:40:26,$$$ intc $$$ did i learn any lesson ? always average down !,13
2020-08-03,19:48:28,intel by 8 / 21 ?,6
2020-08-03,19:43:16,intel by 8 / 21,5
2020-08-03,16:17:16,intc investor class action lawsuit,5
2020-08-03,16:10:18,intc [ bullish ],4
2020-08-03,15:16:31,someone lost on intc ..,5
2020-08-03,03:05:17,$ intc 9 / 11 $ 60c yolo,8
2020-08-02,23:43:15,anyone placing calls on intel,5
2020-08-02,13:29:20,am i crazy ? intc,5
2020-08-01,04:04:36,intc $ 50c 8 / 21 ?,7
2020-08-01,03:56:55,intc $ 50c 8 / 21 bought on july 24 after they announced they couldnt get the 7nm and all the money went to amd . decided to buy 2 at $ 2 . 44 each . im average down to $ 1 . 61 but its valued at $. 48 so far . should i buy more ? and is intel going to pass 50 $+?,67
2020-07-31,22:53:57,hey autists . until now i have only lost money in the crypto scene but id really like to do the same in stocks . where did you faggots get your intel on vocab from ?,36
2020-07-31,19:05:41,bought the intel dip weeks ago . its still dipping .,11
2020-07-31,18:40:55,how screwed am i with intc ? need autistic advice !,11
2020-07-31,16:52:23,"$ 1 , 000 and a dream thanks to intc / amzn weeklies",13
2020-07-31,16:51:15,intel calls are a bargain currently,6
2020-07-31,14:23:10,intc calls making me want to commit toaster bath,9
2020-07-30,18:47:16,looking for a used lambo suitable for a retard . intc $ 44 put 9 / 4,17
2020-07-30,10:48:41,tired of these intel dumbasses,5
2020-07-30,01:10:11,lets cut the bullshit with the doom and gloom for $ intc,12
2020-07-29,19:50:07,should i cut losses on intel ?,7
2020-07-29,19:15:13,will $ intc rally ?,5
2020-07-29,17:46:51,trump and intel seek semiconductor self - sufficiency . bought $ 55 /$ 60c 1 / 15 / 21,19
2020-07-29,16:59:49,yolo on intel ??,4
2020-07-29,14:18:38,seriously wtf is up with this ridiculous intc oversell ? ffs !,12
2020-07-29,14:10:44,seriously wtf is with this ridiculous intc oversell ? ffs,10
2020-07-29,13:44:07,"as i research who to invest in , amd vs intel , nvidia , apple",15
2020-07-29,06:07:00,guess who was long on intc and actively monitoring their price after close ...,14
2020-07-29,01:56:30,bought intel at $ 50 a couple of days ago ... sold during this first spike at $ 59 and the immediately bought back in at $ 49 ! forgot to set alert and missed second rocket ...,38
2020-07-28,20:35:31,my favorite investment strat from reading the intelligent investor .,10
2020-07-28,13:23:17,sell intc before amd earnings ?,6
2020-07-28,05:59:05,double dipping amd and intel ?,6
2020-07-28,01:59:04,"intel fires retards behind 7nm delays , buy calls ?",10
2020-07-27,23:14:47,"intel designers jumping ship , intc to 0 i presume",10
2020-07-27,22:23:24,intc $ 46 call 08 / 21 / 20 exp,10
2020-07-27,22:21:20,intc thoughts on $ 46 call 08 / 21 exp,10
2020-07-27,19:55:04,intel could be planning something big and could win big,10
2020-07-27,19:00:12,intel call thoughts ?,4
2020-07-27,16:16:38,intc reverse butterfly iron condor confirmed,6
2020-07-27,13:58:20,anyone buying the intel dip today ?,7
2020-07-27,10:15:35,intel gang raise up !,5
2020-07-27,10:15:19,third lot of 6 arrows coming to a close . buy puts 7 weeks out . intc 9 / 18 40p,21
2020-07-27,02:16:05,"i ' ve been working on a pretty thorough competitive analysis for amd and intel , enjoy the free money",20
2020-07-27,02:14:26,"i ' ve been working on a pretty thorough competitive analysis for amd and intel , enjoy the free money ( sound on )",24
2020-07-27,01:23:25,boeing intel spotify ge *$* amd ( inversing intel ) wynn fe walgreens,13
2020-07-27,01:19:28,boeing intel spotify ge *$* amd ( inversing intc ) wynn fe walgreens,13
2020-07-27,00:04:37,intel gang stand up !!!!!!!,5
2020-07-26,16:55:31,intel gang in this mf,5
2020-07-26,10:37:32,three waves of 6 spikes . inflection4 starts next week . buy puts for 7 weeks out . intc 9 / 18 40p,23
2020-07-26,08:03:12,intel gang stand uppp,4
2020-07-26,05:41:26,intel stunning failure heralds end of era for u . s . chip sector,14
2020-07-26,00:43:56,intel heralds end of era,5
2020-07-25,23:42:37,how much did intel drop last time they delayed their chips ?,12
2020-07-25,16:50:43,intel gangggg raise up,4
2020-07-25,16:23:07,"intel dd - dependant on amd ' s 10 - q / k , it may be time to short .",21
2020-07-25,16:16:21,i was having a discussion about amd and decided to do some dd on intel to really determine where they make their money .,24
2020-07-25,03:14:27,amd vs intel this week ...,6
2020-07-25,02:47:40,"be ready next week amd tards , intel gang here",10
2020-07-25,02:06:38,who knew goku uses the amd / intel kamehameha wave,10
2020-07-24,22:56:14,your moves on $ intc next week ?,8
2020-07-24,21:03:06,buying that intel dip was a no brainer,8
2020-07-24,20:58:33,intel tendies next week,4
2020-07-24,20:04:36,thank you sue bae . knew amd would shoot up once intc reported earnings . 180 $ 61 calls purchased right before close yesterday . $ 4 . 5k > $ 105k,32
2020-07-24,19:01:24,was getting into intel today a terrible idea ? first big losses this week ...,15
2020-07-24,18:32:20,newbie hit on 1 intel put,6
2020-07-24,17:03:24,intel delays are nothing new,5
2020-07-24,16:35:58,congrats to u / rathadin for his well - informed rant on $ intc - he nailed it,18
2020-07-24,14:38:21,who else is yoloing intel ? why did they just fall off a cliff lol ?,16
2020-07-24,14:35:37,intc down 16 %,4
2020-07-24,14:24:43,anyone buy intel $ 52 . 5 puts ?,9
2020-07-24,14:17:26,intc down 17 %,4
2020-07-24,13:40:42,intc puts . gambled $ 150 and walked away with $ 1400 .,13
2020-07-24,04:54:43,amd and intel forming the rare goku kamehameha wave . nvdia calls to the moon !!!,16
2020-07-24,04:48:24,the amd intel kamehameha wave ...,6
2020-07-24,00:14:48,no - risk iron condor on intc . how is this possible ?,13
2020-07-23,22:45:38,msft a major value right now . intc @ 54 big time deals n steals .,16
2020-07-23,22:28:26,the amd intel kamehameha wave,5
2020-07-23,21:01:16,really stupid intc strangle that may pay out . also i ' m poor .,15
2020-07-23,20:33:04,who else getting some intel fd tendies with me tomorrow ?,11
2020-07-23,20:27:32,who else bout to get some nice fd tendies from intel ?,12
2020-07-23,20:20:44,intel call holder support thread,5
2020-07-23,20:10:50,"intc , amd , or mu ? go",8
2020-07-22,19:15:38,amd just became worth more per share than intel . here ' s why .,15
2020-07-22,17:39:41,thought i would ask my very generous professor for some intel,11
2020-07-22,07:00:12,idk i feel like intel is gonna miss . holdin this bad boy til earnings tho,16
2020-07-21,13:34:14,intel really do be charging you a subscription to use ram at its default speed ...,16
2020-07-20,13:08:12,this is better than what ford is paying intel ( mobileye ) to do . robocop used $ mvis,19
2020-07-16,17:16:25,we are true intellectuals,4
2020-07-15,20:15:45,we are truly intellectual,4
2020-07-15,17:00:36,have i joined the ranks or is this an intelligent play ?,12
2020-07-14,06:48:08,can someone explain is para from the intelligence investor ?,10
2020-07-12,13:49:43,lenovo miix520 intel core i7 8550 8gb ram 512gb ssd 2 in 1 windows,14
2020-07-07,10:59:25,"first ever dd - amd , nvda , and intc",10
2020-07-07,10:50:23,"amd , nvda , and intc - first attempt at a dd",12
2020-07-06,20:11:43,aitx is a penny stock . 1 in a billion thats only . 02 cents headed up to over $ 2 . 00 they sell artificialintelligents regarding wearing masks for covid 19 this stock is like buying the next amazon years ago !!! aitx =$$$$,45
2020-07-02,14:18:21,aitx a company called artificial intelligence !! will climb from . 02 cents to $ 1 . 00 by next week !! it replaces human security guards !! and there ' s a merger and pr headed out ! rated a strong  buy and hold,46
2020-06-29,21:46:30,a ( very intellectual ) analysis of today ' s market gains [ trigger warning ],16
2020-06-26,22:01:35,fb is totally screwed ... ai ( autistic intelligence ) below ...,12
2020-06-26,21:21:48,"anybody know what was up with the sell off of amd , intc and qcom right before close ?",19
2020-06-26,13:49:13,"load up on intel , amd and nvidia now !",10
2020-06-25,07:37:47,"intel caught sort of cheating on benchmarks , "" again """,11
2020-06-23,19:15:48,"$ intc if intel lost apple as a customer , it would be good news : intel would be better off without apples cpu chip business",26
2020-06-23,18:39:14,intel will be fine after losing mac business,8
2020-06-23,18:35:45,time to short intel,4
2020-06-23,08:33:35,apple ditches intel cpu on its laptops,7
2020-06-22,19:15:40,friendship ended with intel,4
2020-06-22,18:50:22,quit thinking intel will drop from the apple news,9
2020-06-22,18:50:14,f thread for intc shorters,5
2020-06-22,11:57:30,"this is good for amd  apple to update developers , possibly signal split from intel",16
2020-06-21,19:38:55,intel going down ?,4
2020-06-19,15:00:44,life came at intel real quick,6
2020-06-19,07:28:25,in depth analysis of amd vs intel ( part 1 / 2 ),13
2020-06-19,01:04:22,get the fuck out of intel and get out immediately .,11
2020-06-17,01:45:57,i think now is the time to reveal to the world my artificial intelligence algorithm that can predict stock market movements . this is the output .,27
2020-06-16,20:46:20,apple officially announcing move away from intel next week ? and other bad intc trends,15
2020-06-16,01:39:11,"me , the intellectual , shorts the stock and loses all of my college fund",15
2020-06-14,15:03:44,"if you think donnie was going to sit around all weekend and let more red dildos bone intelligent smart investors like us retards on monday , think again !",29
2020-06-13,02:08:38,intel $ 50 p 6 / 26,7
2020-06-12,13:41:17,the intellectual hubris of bears never ceases to amaze me .,11
2020-06-12,13:36:18,the intellectual hubris of gay bears never ceases to amaze me,11
2020-06-12,11:40:02,autism = high intelligence ( j . peterson ),9
2020-06-10,19:48:30,intelsat to the moon ??,5
2020-06-09,16:57:31,"dd : short intel , apple is switching to arm",10
2020-06-09,13:57:34,apple announcing theyll no longer use intel processors,8
2020-06-09,13:34:58,apple drops intel cpu . puts on intc,8
2020-06-08,11:14:43,chapter two of intelligent stock market investors,7
2020-06-07,17:19:54,thoughts on lk . anyone with good dd . looking to grab a spike as this stocked tanked due to cooking the books . the coo was ousted . and they are a huge starbucks competitor in china . looking to profit off the swings and need intel if anyone has it .,53
2020-06-06,03:38:21,"went long on intel , abbot , amd , and made $ 180 on an american airways our option .",20
2020-05-26,12:46:46,here ' s a picture of me when i was more intelligent alongside my solid dd,16
2020-05-26,09:02:35,[ amd ] linus torvalds drops intel and adopts 32 - core amd ryzen threadripper on personal pc,18
2020-05-25,05:31:28,"it is late i can ' t sleep , so let ' s look at unusual options activity with intel",20
2020-05-25,00:41:07,"scion asset management , llc - 13f holdings - dr . michael burry - fintel . io",17
2020-05-22,23:42:33,"bloomberg has found us out again . some choice quotes : "" ok , retail is going in and being crazy ."" "" wall street says it will end badly ."" "" it ' s a gamble , an intellectual gamble .. it ' s all about sheer luck """,50
2020-05-21,23:15:13,"man reads the intelligent investor 20 times , still an unintelligent investor",12
2020-05-21,21:38:19,"man reads the intelligent investor 20 times , still an unintelligent investor .",13
2020-05-20,15:02:14,all - in on intc - no way this shit holds above 62,13
2020-05-20,00:11:22,"$ intc consolidating , a big move soon",8
2020-05-19,16:17:19,microsoft ($ msft ) debuts supercomputer for creating human - like artificial intelligence,13
2020-05-19,01:19:40,ok intelllegencia of the stonk kingdom ... will you share to us how you interpret this move in stocks ?,20
2020-05-19,01:17:51,ok intelligencia is the stonk kingdom .... what does move mean to you ?,14
2020-05-15,13:04:05,sen . richard burr stepping aside as intelligence committee chair amid fbi investigation of senators stock sales,17
2020-05-14,16:21:36,sen . richard burr steps down as senate intel chair during coronavirus stock sale probe,15
2020-05-12,07:42:29,my intellectual reaction to musk ' s possible incarceration .,10
2020-05-08,05:36:48,"tencent , intel , and cuckso ( cisco ) making calls next week",13
2020-05-07,00:03:15,amd vs intel vs nvidia,5
2020-05-05,19:13:34,"selling / long - putting boeing is a baffling and unintelligent move that doesn ' t have any rational basis , warren is wrong , and why you shouldn ' t bet against defence . dd",36
2020-05-03,22:45:06,us intelligence documents accuse china of covering up coronavirus outbreak severity to hoard supplies,14
2020-05-02,14:05:09,"short all chinese stocks , chinese is done for ... "" a damning dossier leaked from the five eyes intelligence alliance claims that china lied to the world about human - to - human transmission of the virus ...""",39
2020-05-01,13:40:47,the case for shorting intel . $ intc,8
2020-04-30,19:20:33,"intel could reach new peaks in 2020 and beyond , says bullish bofa",13
2020-04-30,01:36:37,$ intc ichimoku bullish signal,5
2020-04-29,07:31:22,look at the weekly chart for intel . amd will do the exact same thing .,16
2020-04-29,00:09:25,intelsat ( i ) sucks so bad .,8
2020-04-28,23:54:13,intelstat sucks . that is all .,7
2020-04-28,11:06:00,the biggest mistake investors make ( 2020 ) - the intelligent investor,12
2020-04-27,20:08:17,intels 2020 forecast is grim,5
2020-04-26,21:12:19,book : the intelligent investor by benjamin graham,8
2020-04-26,02:05:34,us intel confirms kju walking on his own,8
2020-04-24,21:24:03,small cap value - how to yolo your ira / 401 ( k ) intelligently,15
2020-04-24,01:14:57,riding the intel rocket to hell . $ 130 into $ 2300 in less than 7 minutes .,18
2020-04-23,23:45:05,the problem with the brrr meme is that its an intellectual shortcut that prevents you from trying to understand the complexity of this unprecedented global crisis,26
2020-04-23,20:26:23,"it took mere hours to compile the average intellect , gains , losses , and overall competence of the average wsb user . i present to you , an actual representation of you , yes you reading this . enjoy .",41
2020-04-23,20:20:39,wtf is up with intc,5
2020-04-23,20:11:35,intel drops 4 . 5 % as soon as market closes,11
2020-04-21,20:45:30,guys please get intel trending on twitter so 66 strike call expiring on 4 / 24 an make money . i got the ball rolling .,26
2020-04-21,20:40:03,intel earnings play gone wrong,5
2020-04-21,15:43:13,"goldman , "" we predict a 36 % drop in apple ."" - bulls , "" goldman is always wrong !"" intellectual :",23
2020-04-20,06:52:44,positions for tommorow . looking at intc calls for 5 / 1,12
2020-04-19,04:23:17,intel earnings this week,4
2020-04-18,20:44:21,dump on intel before earnings,5
2020-04-18,04:26:12,5 / 15 intc 65c before earnings . is this my introduction to r / wallstreetbets retardism ?,18
2020-04-12,03:01:54,"smh will dump . short nvda , amd , intc",10
2020-04-10,18:31:25,algos and artificial intelligence mooned the markets after humans were taken off the floor on 3 / 23 ... wtf,20
2020-04-06,02:01:15,thought this was very interesting to read . u / ofortunaa provides a breakdown why trump fired intelligence community inspector general michael atkinson right now and why it matters,29
2020-04-03,13:09:53,"2030 : "" what ' s intel ?""",8
2020-04-01,18:18:33,"breaking : china has concealed the extent of the coronavirus outbreak in its country , under - reporting both total cases and deaths , the u . s . intelligence community concluded in a classified report -",37
2020-04-01,16:38:08,"china concealed extent of virus outbreak , u . s . intelligence says",13
2020-03-28,14:59:40,people with intellectual disabilities may be denied lifesaving care under these plans as coronavirus spreads,15
2020-03-28,13:18:27,might be too intelligent for the newbie,7
2020-03-27,03:06:51,sbux intel of 1 store,5
2020-03-26,20:10:23,"can somebody intelligent explain why 50 , 000 spy 210 puts were bought ?",14
2020-03-24,20:55:06,intc pulling back on share re - purchase and borrowing money - good or bad ?,16
2020-03-23,19:52:11,intel you big bitch,4
2020-03-20,02:53:20,we should mod senate intelligence committee chairman richard burr ( r - n . c .),16
2020-03-20,02:23:36,intelligence chair richard burr unloads stock after reassuring public on,10
2020-03-20,00:04:23,senate intel chair unloaded stocks in mid - february before coronavirus rocked markets,13
2020-03-19,22:50:10,"wsb : spy puts = tendies . me , an intellectual :",12
2020-03-19,08:07:47,the intellects at / r / incesting are losing entire retirements,11
2020-03-16,15:37:04,united natural foods ( unfi ) stock = at least 500 % gain for intelligent investors,16
2020-03-16,11:37:14,"til that bears are considered by many wildlife biologists to be one of the most intelligent land animals of north america . they possess the largest and most convoluted brains relative to their size of any land mammal . in the animal kingdom , their intelligence compares with that of higher primates .",53
2020-03-16,05:02:51,for my fellow  out there on this glorious monday : bears are considered by many wildlife biologists to be one of the most intelligent land animals of north america . they possess the largest and most convoluted brains relative to their size of any land mammal .,48
2020-03-16,02:40:16,"dd : considered by many wildlife biologists to be one of the most intelligent land animals of north america , bears possess the largest and most convoluted brains relative to their size of any land mammal .",37
2020-03-16,00:24:03,"congrats , the intelligence of bears compares to that of higher primates !",13
2020-03-14,21:32:11,"i would like to point out that even if the market doesnt rocket back up , nor drops like a rock on monday , we should do the reasonable and intelligent investor thing .",34
2020-03-13,07:05:49,there are some very intelligent people over on facebook .,10
2020-03-10,23:20:47,intc reports they have a chinky pox case at their chandler manufacturing plant .,14
2020-03-10,05:11:13,the trump administration is stalling an intel report that warns the u . s . isnt ready for a global pandemic,21
2020-03-10,01:47:11,intel is back baby !,5
2020-03-08,02:19:48,get your puts set for intc,6
2020-03-06,23:38:12,long $ intc short $ amd intel pentium processor 4 leaked . intel is back from the dead . sike su bae is laughing,24
2020-03-06,19:03:24,intel security flaw dd,4
2020-03-06,16:22:49,a classmates instagram story . looks like benjamin graham will be rewriting the intelligent investor,15
2020-03-06,04:43:31,wild stock - market swings are emotionally and intellectually wearing on wall street,13
2020-03-04,23:55:53,any spread masters  out there ? wat do with these call spreads ? need some 6d checkers intelligence .,20
2020-03-04,06:47:54,"before hostilities ensue , let me begin by saying i searched for anywhere else to post this , but the reality is this place is the absolute authority and intelligence hub when it comes to anything trading related .. with that being said what the hell are these coupons issued by morgan stanley ?",54
2020-03-03,05:01:24,"$ intc , don ' t let them pimp smack you up",12
2020-03-02,21:22:23,"robinhood to file article 8 section c : in any event of data , server , or any other source of intelligence damage and rendered irreversible or counter intuitive in attempt for recovery of such intellgence , robinhood will only be liable for 2 cents to a dollar of clients assets .",52
2020-03-01,13:58:34,intc rises to 57,4
2020-02-29,05:36:56,corona virus confirmed in portland or area . nike world headquarters and lots of intel and amazon employees here .,20
2020-02-28,17:56:21,why is fucking intelsat going down ?,7
2020-02-28,17:50:55,"intelsat , why is it going down ?",8
2020-02-28,14:45:36,intelsat and fcc meeting today regarding c band payout,9
2020-02-28,14:35:17,let ' s use group intelligence to estimate when amd stock is going to finish plummeting .,17
2020-02-26,19:29:41,intelsat on friday ?,4
2020-02-25,01:53:03,itll go back up ! intel calls,7
2020-02-23,05:44:04,intelsat ($ i : nyse ) bidding war with fcc,10
2020-02-21,07:43:21,$ intc bullish flag beware cuck bears,7
2020-02-21,01:46:21,intel is way undervalued and calls are cheap,8
2020-02-21,00:56:12,holding $ amd ? consider $ intc 3 / 20 for some wicked tendies before the virus news dies out,20
2020-02-20,15:14:03,intelsat - stock symbol i,5
2020-02-20,14:14:26,to those who decided to short intelsat yesterday ...,9
2020-02-19,17:57:15,"okay , very intelligent people first time trading a option how much profit did i make ? did i make a 360 $ profit or is it 360 $ minus 156 $? thanks",33
2020-02-18,21:58:23,"what should i sell to buy more intelsat , deac , spce calls ?",14
2020-02-18,21:05:21,"so i got some intel options , a week ago ! now that its been working swell for me im at a crossroads with what to do with them ! any help is appreciated !",35
2020-02-18,18:27:38,$ intelsat up huge today with appaloosa taking huge stake and challenges fcc decision on satellite rollout next week,19
2020-02-18,18:16:32,"$ intelsat bouncing off lows , huge move in options ... earnings on thursday , appaloosa takes large stake , challenges fcc with satellite rollout",25
2020-02-18,18:06:45,intelsat ( i ),4
2020-02-18,16:01:09,ride or die . i feel bad for intel investors,10
2020-02-11,22:20:29,hello i am new and i am asking for your intellectual support .,13
2020-02-10,21:10:39,im reading intelligent investor - are bonds stocks and stocks bonds ??,12
2020-02-07,03:47:35,one to watch : intelsat,5
2020-02-06,22:18:40,"so this is a fairly new topic with gene editing out of the 3 companies which will be king ? editas medicine , crispr , or intellia therapeutics ??? asking for a friend ....",34
2020-02-06,17:52:54,intelsat 4 $ calls are . 01 . yolod 500,10
2020-02-06,16:34:37,"robinhood is a piece of shit , yet i continue to use it . intelsat really giving you that big of an issue rh ?",25
2020-02-05,17:37:09,bull call of the week - intc,7
2020-02-04,22:51:01,tesla calls fucked me . etoro automatically sells at 50 % loss . hope you autisms enjoy your gains as not all are so intelligent,25
2020-02-04,07:27:13,"intel , and the fall of an industry titan . an look into the future and past of intel .",20
2020-01-29,20:13:48,dd inside intel is going to blow up,8
2020-01-29,18:13:40,so realistically all the china etfs should drop on monday right ? got so many puts on fxi and mchi ill be at one hell of a loss if they dont . i might decend from full spectrum autist to intellectually deficient .,43
2020-01-27,15:07:30,13 . 7k from intc puts exp 1 / 31,10
2020-01-27,09:28:12,intc - would not be surprising if buffett accumulates,9
2020-01-24,23:39:34,[ intel > amd ] will amd fall to $ 45 ? pe huge gains on monday market open ? need yolo fds feeling autistic,25
2020-01-24,22:54:20,selling all my intel stock for amd before q4 earning report 1 / 28,14
2020-01-24,21:26:29,intel and boeing calls first win in 2 years,9
