date,time,processed,word_count
2020-01-24,19:30:02,well ... at least intel is doing well ..,9
2020-01-24,17:46:28,is intc the new amd ?,6
2020-01-24,16:59:56,why we should buy intel too .,7
2020-01-24,12:39:01,intel reported great earnings so the satanist community joined into stonks,11
2020-01-24,02:18:01,intc to 70 by eom . 80 by march .,10
2020-01-23,23:22:38,boeing calls randomly saved me today and i took everything and yolod into intc calls 1 / 31 $ 64 before close . need one more double down for the 10k il have tomorrow .,35
2020-01-23,23:19:29,ubs ups price target of nvda 25 %. intc data center sales increase . nvda up ah,17
2020-01-23,22:30:46,amd ah post intc earnings,5
2020-01-23,21:46:32,intels stock jumps 7 % on better - than - expected earnings and revenue,14
2020-01-23,21:41:38,"my fake account up 5 % on intc earnings report matching q3 2019 , hope someone capitalized on this with real money",22
2020-01-23,03:00:32,intel earnings will update friday,5
2020-01-23,01:11:00,ultimate intel earnings play,4
2020-01-22,19:14:23,buy intel call options : dd,6
2020-01-22,18:57:47,intel sucks ass . playing puts on earnings,8
2020-01-21,12:59:00,short intel into earnings ( dd inside ),8
2020-01-21,10:59:12,short $ intc - i am a google images technical analyst and i wanted to warn you all after my incredible discovery on this shitty company .,27
2020-01-20,13:16:14,intel server chip shortages continue to bite : hpe warns of xeon processor supply drought for the whole of 2020,20
2020-01-20,04:11:04,intel will / could be using tsmcs 7nm process in their 2nd generation gpu,14
2020-01-20,03:08:20,intel ' s 2nd gen xe hp dg2 gpu rumored to be produced on tsmc ' s 7nm in 2022,20
2020-01-19,03:12:51,how to know if youre intelligent or not .,9
2020-01-10,22:29:27,"thank you intel , for hiring me so i can spend my paychecks on amd",15
2020-01-09,00:28:44,if amd doesnt hit $ 50 tomorrow i ' m going out to get myself an intel cpu,18
2020-01-07,21:37:19,long $ amd . this is ridiculous for $ intel,10
2020-01-06,20:11:39,looks like intel is forced to use amd mother boards,10
2020-01-06,20:01:41,intel forced to use amd motherboards,6
2020-01-06,19:04:29,intc 6k yolo in april 60c ' s,8
2020-01-05,23:14:56,big intel that turkey will invade syria tomor,8
2020-01-03,19:25:50,imagine being a bear  stocks only go up and not even trade wars or blowing irans top security and intelligence commander up could stop it,26
2020-01-03,17:18:33,you ' d think investopedia would a bit intelligent,9
2020-01-01,18:56:18,real reason intel why failed to deliver 10nm for so long is because of feminism,15
2019-12-29,19:42:05,has intel decided to stop getting penetrated by amd ?,10
2019-12-16,14:41:05,intel buys israeli ai chip co habana labs for $ 2b,11
2019-12-11,16:06:59,"we are all autistic retards when it comes to "" investing "", but i bet most of us are pretty intelligent people with a gambling problem using this as an outlet .",32
2019-12-11,04:10:26,new exploits found on intel cpus . time to short intc ?,12
2019-12-08,11:38:42,intel is giving up the cpu market !,8
2019-12-07,22:48:03,amd and / or intel call or put ? how long ?,12
2019-12-06,02:31:41,intel : currently a low growth dividend stock - iot is the future - intel corporation ( nasdaq : intc ),21
2019-12-04,15:15:11,intc - research play - thoughts,6
2019-12-03,18:40:49,intel internally announces massive q1 layoffs,6
2019-12-03,15:18:45,$ intc planning massive q1 layoffs,6
2019-12-02,16:37:52,"apple ' s acquisition of intel ' s smartphone modem business completed , intel admits ' multi - billion dollar loss '",22
2019-11-25,17:10:49,found this gem of advice from the 2003 edition of the intelligent investor .,14
2019-11-25,11:27:18,"cisco , singularitynet to decentralize artificial intelligence via blockchain - coindesk 10 million market cap # 276 near all time low",21
2019-11-25,11:19:28,"amd calls , threadripper announcement and intel dropping the ball",10
2019-11-24,19:47:24,proof of contribution  iexec documentation documentation partnered with intel ibm microsoft and alibaba cloud rlc iexec,17
2019-11-23,13:32:58,team  enigma secret contracts for enterprises who want privacy for data health care finances intel partnership 100x roi potential mit team,22
2019-11-22,19:29:18,"chainlink - i exec rlc the next big thing ? rlc partnered with intel , microsoft ibm alibaba cloud",19
2019-11-21,15:30:35,intellectuals over at marketwatch,4
2019-11-21,13:50:15,how should i intelligently purchase a call ?,8
2019-11-21,00:50:04,is it finally time to kill the giant - intel ?,11
2019-11-20,22:52:20,"iexec rlc is now an official member of the confidential computing consortium . the organization gathers major tech companies including alibaba , baidu , ibm , intel , google , and microsoft to improve enterprise standards .",37
2019-11-20,15:39:55,"amd is killing it against intel and gaining on nvidia , but can they compete in new paradigm of semiconductorless computing ? spoiler : fuck no they can ' t .",31
2019-11-19,14:19:57,begining of the end of intelsat,6
2019-11-19,02:40:11,puts on intelsat still good,5
2019-11-18,22:48:21,"after intelsat ' s huge plunge today , would you buy now or wait ?",15
2019-11-15,16:02:07,built ai ( vaccinated intelligence ) that learns from trading mistakes . after 9 days it had the courage to trade,21
2019-11-15,04:55:01,"[ verified ] hey everyone , anderson cooper here ! i ' ve heard a lot about you guys in the wake of this community ' s hacking of robinhood , and hope to collaborate with you on a new show i ' m starting on cnn . it delves into what makes the such internet a special place that harbors intellectual achievement .",64
2019-11-15,04:44:56,"[ verified ] hey everyone , anderson cooper here ! i ' ve heard a lot about you guys hope to collaborate on a new show i ' m starting on cnn . it delves into what makes the such internet a special place that harbors intellectual achievement .",49
2019-11-14,15:16:50,"............................................................................................................. fuck u , intel !",6
2019-11-11,16:18:38,"iexec demonstrates tcf confidential computing application at devcon5 with eea , intel , consensys and",15
2019-11-05,08:44:39,can someone yolo short intel on my behalf,8
2019-10-29,13:13:43,do we see intc going anywhere above 56 ?,9
2019-10-26,15:54:16,"$ amd theorycraft , $ intc comeback",7
2019-10-24,23:59:02,for sale : intel puts,5
2019-10-24,22:26:59,intc - q3 earnings discussion .,6
2019-10-24,22:12:02,intc - earnings discussion .,5
2019-10-24,19:40:28,buy intc puts before close,5
2019-10-24,16:41:06,"short intel , in depth dd below",7
2019-10-24,14:00:34,buy puts on intel .,5
2019-10-18,10:17:00,does anyone have experience with interactive market intelligence data platforms ?,11
2019-10-12,18:21:16,we have officially set the record for the fastest cycle of trumps intelligent trade strategy ( tits ) ever !,20
2019-10-10,06:17:21,"dd came to me in a dream . the dream said buy puts , probably on $ intc .",19
2019-10-07,21:53:22,what do you intellectuals think about the overnight repo lending ? another $ 45b tonight,15
2019-09-29,22:20:36,house intel committtee has reached an agreement for trump - ukraine whistleblower to testify ' very soon ',18
2019-09-26,12:42:18,house intelligence committee releases whistleblower complaint about trump,8
2019-09-24,15:08:00,president trump kept talking about how he won ' t negotiate a deal that doesn ' t include intellectual property changes . could this be holding the trades back ? $ spy puts ?,34
2019-09-15,22:32:41,microsoft ditches intel : surface laptop 3 might use the powerful amd ryzen chips,14
2019-09-09,20:34:49,"failure is simply the opportunity to begin again , this time more intelligently",13
2019-09-08,21:42:51,big name microchip intellectual property vs net margin .,9
2019-08-10,18:26:14,""" givemeadollar "" is probably an r / wsb mod now ( from ben graham ' s "" the intelligent investor "")",22
2019-08-10,04:53:49,psa : amds new epyc 7002 series rome server processor is firmly ahead of intels xeon . i would strongly consider investing ...,23
2019-08-08,19:02:36,thoughts on intc ?? i hold calls on dec $ 50,11
2019-08-08,18:17:39,i feel like i am cheating on my computer by investing in amd . intel gang .,17
2019-08-07,00:50:09,atvi !? what ' s the consensus around these halls of godly intelligence !?,14
2019-07-31,02:48:41,intc to the doghouse,4
2019-07-30,17:03:24,intc puts for amd er,5
2019-07-26,17:51:29,why hasn ' t intel spiked with the apple announcement ?,11
2019-07-26,17:00:24,short $ intc because of bob swan ' s guilty face !,12
2019-07-25,21:46:11,the boomers where right fucking intc went up,8
2019-07-25,20:24:44,told you retards to buy intc calls and you called me autistic .,13
2019-07-25,20:10:23,$ intc earnings thread,4
2019-07-25,20:05:06,apple to buy intels smartphone chip division for $ 1b,10
2019-07-25,19:30:46,$ intc intel earnings thread ; keep all discussion here,10
2019-07-25,15:28:00,$ intc earnings : wintel or shmintel ?,8
2019-07-25,06:51:35,intc calls = free money after earnings today .,9
2019-07-23,18:26:38,why is anyone buying intel ?,6
2019-07-22,21:38:56,wsj : apple in advanced talks to buy intels smartphone modem chip business,13
2019-07-22,21:33:18,apple ( aapl ) in late stage discussions to buy smartphone modem chip business from intel ( intc ) for usd 1bln,22
2019-07-14,18:43:56,intc closes over $ 50 by tuesday or ban me .,11
2019-07-11,23:11:56,rumor : intel to sell 3d nand business to sk hynix,11
2019-07-10,15:34:17,apples buying intel ( modems ),6
2019-06-30,07:58:38,amd vs intel cpu sales q1 2017 ~ q1 2019 [ largest retailer netherlands ],15
2019-06-28,00:05:58,went full autist . bought some intel 08 / 02 $ 51 strikes .,14
2019-06-20,00:55:30,read the intelligent investor it would help you a lot,10
2019-06-19,14:29:42,intel not outsourcing 14nm rocket lake cpu production to samsung,10
2019-06-13,20:28:30,turns out unintelligent fungi are better traders than most of us,11
2019-06-12,00:46:43,potential intel gains ?,4
2019-06-05,20:10:50,appl tsla ko atvi intc msft,6
2019-05-31,17:34:43,new intel security flaw . amd and arm unaffected,9
2019-05-29,18:20:44,the past few years of intel finally make sense,9
2019-05-27,17:31:22,smoking hot girl says intelligent stuff,6
2019-05-27,09:17:02,intel is going down and amd on its way up,10
2019-05-26,17:10:15,"intel announces 8 core i9 - 9900ks : every core at 5 . 0 ghz , all the time",19
2019-05-20,07:15:41,"intel , broadcom , qualcomm and others against huawei",9
2019-05-17,19:58:30,all in $ amd : $ intc new vulnerability may reduce performance by up to 40 %!!,17
2019-05-16,22:35:43,i guess mint knows i have the intelligence of a 8 year old,13
2019-05-15,18:45:01,"some good dd regarding intc security flaw . saw this in r / stocks and wanted to share here . ( intc , amd )",25
2019-05-15,14:28:56,intel tried to bribe vu university amsterdam into suppressing news of the latest security flaw,15
2019-05-15,04:22:50,intel zombieload flaw forces os patches with up to 40 % performance hits,13
2019-05-15,03:54:54,zombieload : the newest intel cpu vulnerability,7
2019-05-15,03:11:52,$ intc with a massive new hardware exploit . buy $ amd ?,13
2019-05-13,05:15:56,play of the week : intc atm calls,8
2019-05-10,22:51:54,i ' ve listened to 1 hour of the intelligent investor : when do i get to meet elon musk ?,21
2019-05-07,15:07:56,mu buying assets from intel ? long mu ?,9
2019-05-06,14:46:25,warren buffett says stocks look like ' intelligent investments ' compared to bonds today,14
2019-04-30,20:30:34,why is intel losing vs ayymd ?,7
2019-04-29,15:22:33,any1 else think the damage is done to intel ? whos buying the dip with me ?,17
2019-04-27,21:32:21,from down 20 % to up 20 % in two days ($ dis $ msft $ intc $ unh ).,20
2019-04-27,00:39:26,time to buy more intel puts just for the cringe .,11
2019-04-26,17:09:09,was intc ' s er the result of amd taking market share ?,13
2019-04-26,15:52:04,intel marketing vs amd marketing,5
2019-04-26,15:28:34,loading up on intc and riding it back up to $ 55,12
2019-04-26,13:40:11,i think i i did something right for once ( intel btw ),13
2019-04-25,18:35:47,bob swan ... ceo of intel !!! swan people ... people .... what the fuck is a swan ! its a bird ! its a plane ! ... nope thats just intel flying to the fucking moon,37
2019-04-25,14:36:37,want super exposure to intel taking a fat l tonight ? try soxs and ssg,15
2019-04-25,03:58:39,"long amd , intel puts",5
2019-04-20,00:59:38,intel 10nm : the art of lying without technically lying,10
2019-04-17,20:16:16,why i am buying intel,5
2019-04-17,16:45:05,prediction : aapl will acquire intcs modem division / ip,10
2019-04-16,23:52:54,intel drops out of 5g modem business after apple and qualcomm settlement . could this hurt intel ?,18
2019-04-14,20:20:29,` merica coin replaces u $ dollar  us mint in philadelphia invites intel for overhaul .,17
2019-04-14,16:50:55,"model scammed - hackers tricked a tesla model s , and it ' s a sign of things to come in the race to fool artificial intelligence",27
2019-04-14,00:18:47,spoiler : it ' s not worth shorting intc anymore since trump declared mandatory dow 30k but maybe don ' t buy any more intc calls,26
2019-04-09,18:20:59,qualcomm ( qcom ) has introduced a new data chip for artificial intelligence cloud data services,16
2019-04-09,07:42:56,long intel ( intc ) boys shits going thru the roof after this year,14
2019-04-09,01:39:30,leading cannabis companies to embrace artificial intelligence ( ai ) to significantly boost global sales,15
2019-04-08,23:37:05,reading intelligent investor and found out the cramer indicator has been reliable since 2002,14
2019-04-02,19:01:50,intel introduces shitty new processors that use 2 dies to draw 400 watts but only have 56 cores . long $ amd,22
2019-04-01,16:52:53,intel confirms mass layoffs across its american facilities,8
2019-04-01,03:06:48,i am not a financier or economist . i am electrical engineer with equal passion in artificial intelligence and financial markets . for the past 2 years i have been working on a system that would make short term predictions of stocks .,43
2019-03-31,22:43:44,"i ' m bearish chip stocks but encouraged by recent reports . foxconn ( iphone builder ) reported underwhelming growth friday , huawei reported outstanding growth friday .. micron and intel created a new product called optane . the top left i tracked dram price decreasing on amazon in march and reviews",52
2019-03-31,20:18:28,intel leak discussion and implications for micron / amd / nvida .,12
2019-03-30,20:09:42,new nsa backdoors found in intel chipsets . it ' s time to buy $ intc leap 50 puts ( never a bad decision ),25
2019-03-29,05:26:07,short intelligence ! rip,4
2019-03-26,17:11:36,"intc folsom , ca letting go of much of it",10
2019-03-23,02:37:46,saw this on tucker and laughed .... swalwell on the intelligence committee ? lol,14
2019-03-21,15:43:18,"$ intc puts , $ amd calls",7
2019-03-19,16:04:49,lyft : risky valuation and no intellectual property,8
2019-03-11,20:14:50,intel cpu shortage continues,4
2019-03-11,18:32:12,nvidia outbids intel to buy israel ' s mellanox in data centre push,13
2019-03-06,14:14:07,forbes : intel at disadvantage to amd due to new cpu vulnerabilities,12
2019-03-05,13:01:42,"more intel cpu vulnerabilities revealed , all core cpu lines affected . amd totally unaffected . long su bae , short intc",22
2019-02-25,11:20:06,""" i am pleased to report that the u . s . has made substantial progress in our trade talks with china on important structural issues including intellectual property protection , technology transfer , agriculture , services , currency , and many other issues . as a result of these very ......""",52
2019-02-23,20:51:02,"micron quarterly financials . they produce chips for cloud servers and networking ($ 15 . 25b revenue 2018 , $ 8 . 62b in 2017 ); memory products ( 2018 $ 6 . 58b , 4 . 42b 2017 ); and ssd for intel ($ 5b , 4 . 5b 2017 ) in taiwan , singapore , the united states , japan , and china . they have a legal battle with fujian jinhua",74
2019-02-23,19:10:50,the revolutionary way of using artificial intelligence in hedge funds,10
2019-02-23,16:57:05,wsb level intelligence right there,5
2019-02-21,22:50:22,general census on global x robotics and artificial intelligence eft,10
2019-02-17,23:34:44,the collective intelligence of the dis - info crowd on display ( large gain for the day ),18
2019-02-08,00:02:07,i have no clue what the fuck i ' m doing but i made $ 655 on some intel calls earlier this week . i ' ll report back when i ' m down 10k,35
2019-02-01,20:34:11,"sonasoft corp ( ssft ) signs letter of intent ( loi ) to acquire artificial intelligence ( ai ) company , hotify inc",23
2019-02-01,07:14:22,does anyone find the finance industry boring ? i kind of wish i was in tech at nvidia or big data at palantir or the intelligence community through black cube . all of that seems more interesting than working at a hedge fund . idk,45
2019-01-31,14:28:10,"intel names ceo , down 2 % premarket .",9
2019-01-29,14:19:55,everyone seems to assume amd will have a shit earnings or guidance because of nvda ... i seem to remember the same thing when intel was getting hit a few years back and amd killed it with ryzen ... anyone else think it might be the same story different processor unit ?,52
2019-01-29,00:43:21,this what my $ intc puts will be going to this weekend .,13
2019-01-26,23:57:32,how will amd er going to look after intels not so well er ?,14
2019-01-25,19:25:10,"trump : "" these are not medieval walls , they are smart walls "" ( long intc )",18
2019-01-25,14:40:22,intc gains . 122 %,5
2019-01-24,21:47:35,whats up with the autism bashing when theyre above average intelligence ?,12
2019-01-24,16:43:08,what would happen in the market if intel missed earnings and the stock drops,14
2019-01-24,01:41:56,"intel ( intc ) quarterly reports . they report 1 - 24 - 2019 after hours . their revenue , operating profit , and profit have been growing well yoy in 2018 . txn reported 1 - 23 after hours ( recent report in comments ). although tariffs started sept 24 and apple / samsung lowered guidance , i ' m slightly bullish",63
2019-01-23,17:25:21,i am intellectually disabled,4
2019-01-16,03:27:47,intc looking to buy amd,5
2019-01-15,18:16:06,"mu buy intel flash memory , this is bad for $ mu",12
2019-01-04,02:36:37,intel ($ intc ) is a terrible fucking company,9
