date,time,processed,word_count
2021-02-15,20:02:06,intel - welcome to value town,6
2021-02-15,19:13:08,"jinxed by intc , twice and still thinking about a third time",12
2021-02-15,18:38:42,"jinxed by intc , twice",5
2021-02-15,06:26:44,intc in the medium to long term,7
2021-02-14,21:00:14,intc - catalysts for a breakout of all time high and the road to trillion dollar market cap,18
2021-02-14,17:41:26,when i asked fintel why they were manipulating data for the hedge funds .... this was there response . what a load of bs !!,25
2021-02-14,10:41:38,$ tyme could be the next $ ocgn ?? first 6 weeks 2021 > 72 < tutes filled 13f ( green rows indicate new positions )  because of tyme granted u . s . patent claims covering use of tyme - 19 to treat covid - 19 infections ?? company has more than 100mill dollars of cash until 2024,60
2021-02-13,18:14:00,"intel ' s hidden gem , mobileye",7
2021-02-13,17:48:21,intc is fundamentally undervalued . short term tendies are possible,10
2021-02-13,17:32:27,$ intc is way undervalued and about to take off . here is why,14
2021-02-13,14:20:55,welcome to intel ( intc ) value town,8
2021-02-13,10:41:14,amd and intel dd,4
2021-02-13,10:39:38,i like this stock  $ 4 . 5k gain so far on intc . went long the jan ' 22 expiry and bought some shorter term stuff with the july ' 21 calls too .,36
2021-02-13,03:57:57,$ intc ready for a monster run,7
2021-02-13,02:38:39,intel ( intc ) - value town,7
2021-02-13,02:08:06,novn ! looking for intel on one of my picks . novn,12
2021-02-12,16:33:12,"intel is dying , and we cant save it",9
2021-02-12,16:29:17,the future of semiconductors and why intel is poised to win the war,13
2021-02-12,10:55:27,recruiting for intel gang . this baby is going to pluto in 2021 - 22 !!!,16
2021-02-12,07:33:51,bought 2k worth of aitx . good penny stock for artificial intelligence with uptick in sales and healthy price growth,20
2021-02-12,04:19:43,"what does tsm , asml , and amat have in common ? hint ... intels demise .",17
2021-02-12,02:56:29,"small yolo on $ amd $ intc $ sndl $ spy , give me more ideas ! or roast",19
2021-02-11,22:47:45,can intelsat fly again after bankruptcy ?,7
2021-02-11,22:25:42,"$ amp is moving ! i ' ve never had ownership in something that moved so high so suddenly . i have good intel that she ' s getting listed on coinbase soon , too . sorry , cant cite the source on this one ! i just threw in $ 2000 more . ( originally invested $ 400 and now , it ' s $ 2200 )",68
2021-02-11,21:18:52,why intel will reap huge benefits from biden administration policy - $ intc dd,14
2021-02-11,20:04:01,thoughts on intel ?,4
2021-02-11,20:02:44,recruiting for intel gang . this baby is going to pluto in 2021 - 22 . amd cucks keep out !!!,21
2021-02-11,18:45:35,"( intc ) intel , a diamond amidst coal",9
2021-02-11,18:32:34,( intc ) intel the diamond in amidst coal,9
2021-02-11,18:17:29,intel ( intc ) is the most undervalued stock,9
2021-02-11,16:41:06,intel vs tsm - time to invest in intel ?,10
2021-02-11,16:40:14,intel waking up from long slumber,6
2021-02-11,16:38:33,tsm vs intel - is intel waking up ?,9
2021-02-11,16:35:52,"i did a very non intelligent trade into $ sndl . can you guys please help me out , i would really appreciate it . my paypal is",28
2021-02-11,15:36:56,buy amd as it can crush intel again in 2021 | the motley fool,14
2021-02-11,02:30:20,"plebs .... thats ' plebeians , for thou who art not so intellectually adept - and this shit is simple ... listen up ,",24
2021-02-11,01:54:11,what do you guys think of that artificial intelligence that day trades equitys ? aeiq,15
2021-02-10,22:49:12,i just bought 2 stocks in each $ amd and $ intc,12
2021-02-10,21:44:37,time for the $ intc run,6
2021-02-10,19:31:19,fintel worth it !,4
2021-02-10,17:55:30,"vanguard group inc ownership in ocgn / ocugen , inc . - 13f , 13d , 13g filings - fintel . io",22
2021-02-10,17:38:19,can artificial intelligence bring a new gold rush ?,9
2021-02-10,15:54:51,"hi all , im interested in learning more about investing and im starting with research on how to conduct my own security analysis . the books i have thus far are intelligent investor , security analysis , and you can be a stock market genius . what else should i read to prepare myself ?",55
2021-02-10,14:26:43,fintel gme short shares availability - please explain,8
2021-02-10,10:55:56,is a good moment to invest in es0152768612 airtificial intelligence structures sa,12
2021-02-09,17:38:47,intellicheck ( nasdaq : idn ),6
2021-02-09,17:32:11,qr codes are here to stay ! intellicheck ( nasdaq : idn ). hop in we are going to the moon !,22
2021-02-09,16:54:34,gme squeeze is over . fintel update .,8
2021-02-09,15:19:34,extensive dd into fintel short volume alterations,7
2021-02-09,13:52:00,is fintel down for gme ????,6
2021-02-09,12:27:49,25 % gme and 31 % amc short interest according to fintel updated,13
2021-02-09,06:30:14,recommended by warren buffett himself . the intelligent investor : the definitive book on value investing .,17
2021-02-09,04:08:11,repost from r / gme : fintel short data altered for gme and amc,14
2021-02-09,04:06:30,emailed finra and news outlets regarding fintel modifying historical short volume / ratio numbers ( market manipulation ) ( crosspost with wsbelites ),23
2021-02-09,03:27:17,fintel messed with the numbers,5
2021-02-09,03:18:15,"trey ' s trades prove manipulation . the website fintel altered / manipulated the short volume data on their site for amc by reducing the actual short volume by 50 %. falsely reporting short volume should be , or is illegal .",42
2021-02-09,02:44:46,"trey ' s trades shows how fintel on 2 / 8 / 21 changed / manipulated the short volume for the previous days . this is actually insane , as long as manipulation benefits the hedges it ' s fine . something shady is going on . this needs to be seen",52
2021-02-09,01:05:06,$ mstr dd - hyperintelligence and digital assets - michael saylor the balance sheet god - long term growth,19
2021-02-08,18:52:24,requesting intel from fellow retards,5
2021-02-08,17:27:27,intelgenx not only cannabis films strip with tilray an heritage as partners . pet film strips to,17
2021-02-08,17:11:10,fintel has been changing numbers of reported short volume,9
2021-02-08,17:09:07,fintel changing numbers reported on short volume,7
2021-02-08,16:40:42,fintel altered short volume data for gme,7
2021-02-08,16:24:21,"fintel changed their short volume data after my last post , and i have the receipts to prove it . ( gme )",23
2021-02-08,16:20:34,fintel altered short volume data after my analysis on friday - i have the receipts ( gme ),18
2021-02-08,15:55:14,palantir soars on artificial intelligence partnership with ibm  thestreet,10
2021-02-08,15:10:26,palantir soars on artificial intelligence partnership with ibm,8
2021-02-04,22:45:24,"intc - zachs says buy , i buy .. holding 4 / 16 57 . 5c lets go !!!!!",19
2021-02-04,21:28:18,move to intc and fire the chip world,8
2021-02-04,19:50:57,[ cpta ]( with 400 % short interest !!! no volume at all !!! lets fuck the wall fucking street !!,21
2021-02-04,19:15:40,"china , i think we should all reduce our purchases from them . they have stollen our identities , they steal intellectual property rights , they are currently undertaking genocide and they created the covid virus and create 30 percent of world pollution .",44
2021-02-04,19:14:42,elon musk : on artificial intelligence and hedge funds in 2016,11
2021-02-04,15:43:27,your opinion on the intelligent investor .,7
2021-02-04,15:36:45,[ cpta ]( with 800 % short interest !!! no volume at all !!! lets fuck the wall fucking street !!,21
2021-02-04,14:49:17,our hands may be in the toilet but they can ' t flush them like we ' re some paper intellectuals because ours are made of diamonds and clogging the drainage .,32
2021-02-04,14:41:25,our hands may be in the toilet but they can ' t flush them like we ' re some paper intellectuals because ours diamond hands are clogging the drainage . and when they have used up all the water we will pull our hands out and hit,47
2021-02-04,09:41:46,"from "" the intelligente investor "" newsletter -",8
2021-02-04,06:25:45,"finally got an update on shares available on fintel . io , do what you will with it . they haven ' t updated it in days . they kept the info away from a service i pay for . sharing it with you . last update 30ish mins ago which would be 00 : 53 est .",58
2021-02-04,03:52:39,can someone with a above average intelligence please explain why the buy pressure is so high but stonk no go up .,22
2021-02-03,20:19:04,where are intelligent content creators ?,6
2021-02-03,18:22:41,[ cpta ]( with 4000 % short interest !!! no volume at all !!! lets fuck the wall fucking street !!,21
2021-02-03,17:00:22,sifting ape for intel ( buy sell order volumes ),10
2021-02-03,15:31:46,"drop in the price of gamestop is mostly caused by institutional sell - offs . according to fintel , roughly $ 80m was sold and only $ 20m purchased . however some institutions are still buying !",37
2021-02-03,15:09:49,blackberry and  join forces to accelerate innovation with a new intelligent vehicle data platform,15
2021-02-03,13:05:47,punch $ amc through . 121m short interest ( fintel ) and basically no walls this morning . buy this dip before market opens and the ~ 55m market orders flood in .,33
2021-02-03,11:21:22,doodlemaker latest launches - make doodle videos in no time with futuristic artificial intelligence technology,15
2021-02-03,08:21:03,"listen up u apes , here ' s some intel for tomorrow ' s fight",15
2021-02-03,07:50:46,"ok , so what is the actual hard evidence that $ gme can recover . i know it ' s impossible to know for certain but what stats and past instances do y ' all intellectual apes have ?",39
2021-02-03,07:34:20,"during the hold , which may take few weeks ( i don ' t care ) lets get on with other work and honestly lets share some information on very undervalued stocks from all industries . please no nonsense posts , just a brief intel on a stock that ' s been beaten down to 2 - 3 - 4 - 5 - 6x earnings ( earnings not revenue )",70
2021-02-03,01:15:58,holding strong let ' s fucking go fellow retards !  also what yall think about artificial intelligence . this other little guy i have interests me .,28
2021-02-02,23:49:35,gme shorts raised today ( from fintel . io ),10
2021-02-02,23:49:27,"$ gme short volume is up today , and is 2 . 3 times yesterday ' s volume  | fintel",21
2021-02-02,23:28:14,fintel data says most of the shorts have covered as of yesterday - but there wasn ' t enough volume for this to happen ?? could they have done this after hours or concealed their shorts somehow ?,38
2021-02-02,22:31:20,short information regarding gme on fintel,6
2021-02-02,22:08:47,anyone saw this ? blackrock inc almost doubling on shares ownership of amc . source :,16
2021-02-02,21:34:06,had a very intelligent discussion during a zoom call today ... the 3 messages second from the bottom are from my professor,22
2021-02-02,21:31:56,had a very intelligent discussion during a zoom call today ... the 3 messages second from the bottom were from my professor,22
2021-02-02,20:22:17,"bought three at 196  obviously im holding , im not an intelligent person",14
2021-02-02,20:00:08,can someone with at least average intelligence calm my fears,10
2021-02-02,19:30:30,"friend was skeptical , and i have the brain power of an atari 7800 thats been buried in the gamestop hq basement since 1986 , but do yall incredibly intelligent fellow diamond handers think my summation is fairly accurate or am i truly a box of rocks ?",48
2021-02-02,18:55:21,fintel screenshot 0 gme shorts available 2021 - 01 - 28 13 : 39 : 30 .,17
2021-02-02,17:05:20,tesla to invest in byd ? any intelligence and or opinions on that ?,14
2021-02-02,16:45:14,ive got so little on the line and so little intelligence that i am never selling this stonk .  my ape brain even bought more because i love discounts almost as much as i love this stock .,39
2021-02-02,16:32:48,"some words of wisdom all of you dumb fucks could use , from the book that describes the exact fucking opposite of what we all are : the intelligent investor",30
2021-02-02,16:22:55,opgn fda approval coming soon redditeers ! intel expects this month ... will be huge,15
2021-02-02,15:31:09,"swiss financiers : intellectual property securities corporation ( ipse ) receives nasdaq ticker , announces intent to list via ipo",20
2021-02-02,14:52:26,i want in . enough is enough . i haven ' t the time or intellect for my own damn research someone please tell me how i can get on board trading as easily as possible . ideally an app that isn ' t a lil bitch like robin hood,50
2021-02-02,14:29:06,$ atds joined microsoft intelligence security association penny stock,9
2021-02-02,10:41:10,when you see your actions on the top news discussed in davos you know you have done something right . check,21
2021-02-02,04:44:54,projections of shorts for gme,5
2021-02-02,03:41:48,"beautiful exchange platform and its corner !! i went to see because i hear from several of this area . his risk of shaking !! in short , remain concerned and patient but above all intelligent !!!",37
2021-02-02,00:49:15,"so the current reported shares ownership of gme sits at 113 , 649 , 303 or 162 . 95 % of the company . this isn ' t including retail owners . ( sauce",34
2021-02-02,00:20:07,so robinhood is in the business of insulting our intelligence now too,12
2021-02-01,22:27:59,airtificial intelligence - hyperloop,4
2021-02-01,22:20:27,need a more intelligent retard to explain such a continuous slow decline to under 200 today,16
2021-02-01,21:29:01,"warren buffet : "" it ' s a temperamental quality , not an intellectual quality ""; stay calm , stay in , because we like the stock",27
2021-02-01,20:35:22,artificial intelligence and the gamestonk blowback,6
2021-02-01,20:05:27,"we as gamers need to raise stocks that power our gaming . we need intel , amd , and nvidia . maybe even yum ! which owns kfc . we need that kfconsole",33
2021-02-01,19:19:35,"if the most intelligent entity of the motherfucking planet says hold . you know you have to hold .  we officially are shouting a pornoscene , autistics retards gang banging ugly wallstreet hoes stuck on the door of a gme store",42
2021-02-01,18:43:31,"yes , im a new member . im not a bot . been reading this for a few weeks . super impressed by the passion and intelligence here . ( even though i know we are all so dum . hubby and i are holding amc with diamond  just wanted to say hello and stay strong everyone !",59
2021-02-01,18:24:39,shorts are starting to cover according to market intelligence firms .,11
2021-02-01,17:34:31,"short interest in the video - game retailer plummeted to 39 % of free - floating shares , from 114 % in mid - january , according to ihs markit ltd . data . data from s3 partners , another market intelligence firm , showed a similar pattern , with gamestops short sales having fallen to about 50 % of its total stoc",63
2021-02-01,17:22:44,"market intelligence firm , estimates $ gme short interest has collapsed to 39 % ( from 114 %)",18
2021-02-01,17:02:23,"am i a retard for holding 3200 shares of amd ? dd looks aight but intel bonks rn , why ?",21
2021-02-01,15:57:53,this might scare the average intellectual but not me im too retarded and  to get spooked ! i like the stock !,23
2021-02-01,15:53:27,"even in the middle of ladder attacks and while the price is dropping , buy volume far outweighs that of sell volume . its just intelligent algorithms that are dropping the price , not people selling .",37
2021-02-01,14:53:26,"$ intc , intel insiders ceo and cfo",8
2021-02-01,14:35:21,"$ intc , intel ceo and cfo are buying , p / e only 11 , yield 2 , 5 %.",21
2021-02-01,13:51:57,intel ?? who has thoughts on it ?,8
2021-02-01,09:47:16,let ' s to intel next,6
2021-02-01,06:35:10,"according to cointelegraph news site , there is an official "" crypto wing "" of wsb - true or just ct shoddy reporting ?",24
2021-02-01,06:08:02,this one could and should be huge ! inteq / intelsat s . a .,15
2021-02-01,04:22:18,buy amd to fight against the intel . amd amd amd amd,12
2021-02-01,04:02:16,i did more researching citadel has had shares since the bottom lows during march  fintel also reports multiple calls during 2020 . who knows if they excercised those contracts . they may even have more shares . they ' ve probably already profiting 100 $ mil since then . say no to slv .,55
2021-01-31,23:20:58,"everyone who lost money with intel , microsoft and facebook earning report should know this .",16
2021-01-31,23:08:58,$ gme - artificial intelligence predict gamestop,7
2021-01-31,22:14:39,"the weapon i have equiped on my druid for this week . they have no intellect , so don ' t listen to me",24
2021-01-31,22:08:36,chesapeake energy ( chkaq ) - intelligent investment opportunity ?,10
2021-01-31,21:13:19,appears the latest hype for slv might be due to citadel owning a vast majority of the shares . but don ' t take my advice i ' m just a ape tard .,34
2021-01-31,19:56:33,intellectually trying anything at this point ! still holding,9
2021-01-31,19:33:57,intel stock holders are pulling out,6
2021-01-31,09:08:19,someone add up all the shares and tell me what it is ( hint they own ( ed ) 101 . 95 % of the shares,26
2021-01-31,08:47:00,can i get unbanned : c i accidently forgot that we cant talk about crypto in chat i was trying to tell the nitro crew we are getting flammed by cointelegraph and i accidently said xrp im sorry please it wont happen again : c i completley forgot,48
2021-01-31,01:24:47,where do my fellow retards get their intel ?,9
2021-01-31,00:06:06,"me , an intellectual",4
2021-01-30,23:15:41,im such a low intelligence ape what could all this mean,11
2021-01-30,20:21:22,"let ' s talk about $ intc , let ' s talk about $ amd",15
2021-01-30,19:07:48,black rock now owns 6 % of nokia . black rock released their sec filing and reported that they bought an additional 22 million shares of nok and now own 6 %. smart money must have an idea of something happening ..,42
2021-01-30,18:58:19,"where can i buy stocks , is it intelligent to still buy stocks even though i have no clue about it ?",22
2021-01-30,18:57:40,blackberry and aws join forces to accelerate innovation with a new intelligent vehicle data platform . learn how # blackberryivy will allow automakers to create personalized driver and passenger experiences and improve operations of connected vehicles . bit . ly / 37zg0gc,42
2021-01-30,18:11:18,bb and intel working together on qnx ev platform,9
2021-01-30,17:41:08,beat the hedges back with counter intel,7
2021-01-30,17:20:23,intel is working with blackberry on building their ev platform .,11
2021-01-30,13:30:40,the ability to speak doesnt make them intelligent,8
2021-01-30,12:27:46,the ripple effect - artificial intel agency,7
2021-01-30,12:18:31,the ripple effect - artificial intel agency ( xrp ),10
2021-01-30,11:41:06,wwe stock is the next move ( forbidden intel itt ),11
2021-01-30,11:34:25,don ' t allow this to happen to wsb . garrity ' s law of inverse congregational intelligence .,19
2021-01-30,11:19:20,don ' t allow this to happen to wsb  garrity ' s law of inverse congregational intelligence .,19
2021-01-30,07:43:56,"it is not the strongest apes  that survive , nor the most intelligent , but the most responsive to holding the line ~ deepfuckingvalue",25
2021-01-30,07:37:29,"it is not the strongest apes that survive , nor the most intelligent , but the most responsive to holding the line ~ deepfuckingvalue",24
2021-01-30,05:13:14,sold 6k intel shares to go all in on amc,10
2021-01-30,05:03:00,its not only us - they are intellectually degrading as well .,12
2021-01-30,04:28:55,"boomer being boomer , while applauding you all , holding my copy of intelligent investor to the heart and doing what i know and understand .",26
2021-01-30,03:48:44,intel ( intc ) value stock,6
2021-01-30,02:05:49,i literally know like nothing about investing . can someone point me in the right direction ? im like an average intelligence kinda guy . woooooohstonks,26
2021-01-30,00:44:45,"intelligencer passing off a marketing professor as an authority on the stock market to push gloom and doom . hold people , don ' t let the media distortions warp your brains !",33
2021-01-29,23:09:32,update gme !!! borrow rate 33 % ( fintel ). hold the fucking line retards let them pay,18
2021-01-29,22:59:50,amc borrow rate is now 21 % according to fintel,10
2021-01-29,21:26:40,"amd ??? next !!!! amd is worth at least 100 , all good numbers , news , orders yet the shorts dont like amd and trying to bring her down !!! amd is challenging intel and they dont like it , challenging the chinese and they do t like it !!! we need to show the huge shorts that amd is a giant !!!!",64
2021-01-29,21:14:19,joe rogan called us intelligent vipers,6
2021-01-29,19:47:03,aitx artificial intelligence technology solutions inc . what do you think ? buy or hold ?,16
2021-01-29,18:36:49,"the wall street "" intellectuals "" look down at us and think we are just primitive apes who do not know what we are doing . well guess what ? apes . together . strong !!",36
2021-01-29,17:06:02,"lonestone has arrived in reddit ... this platform is new to me . so bare with me ... i am here to give you the keys to success ... i have intel beyond human comprehension ... its called common sense ... just listen , and you will receive massive returns ...",51
2021-01-29,16:53:59,artificial intelligence digital asset = #$ fet - autonomous driving and decentralized exchange,13
2021-01-29,16:30:11,artificial intelligence technology ( aitx ) is going to fly soon ! get ready,14
2021-01-29,16:06:49,"blackrock inc . ownership in ades / advanced emissions solutions , inc . - 13f , 13d , 13g filings - fintel . io blackrock making bets",27
2021-01-29,15:45:53,why not intel guys . $ 100 stock of iconic stocks telling in $ 50s . shorted by hedge funds,20
2021-01-29,12:34:05,message for the hedgies feverishly monitoring this sub for intel .,11
2021-01-29,11:17:53,ozgyo in bist index . this price is looks good for 1 weeks trading . i will buy from there and i will sell 3 . 82 . i am using artifical intelligence bots for analyze cheap prices .,39
2021-01-29,08:40:37,"amd - best cpus , tops earning , takes on intel and still goes down . why ? because of 71 million short interest ! funds keeping it down !",30
2021-01-29,08:13:12,intelsat ( inteq ),4
2021-01-29,06:48:06,this notorious guy thats taken other companies by the balls has intel on these scum . spread,17
2021-01-29,06:15:04,why arent we running counter intel ?,7
2021-01-29,05:15:19,"intelsat stonk dd , good buy for those who can stomach it !",13
2021-01-29,02:53:41,wall st is no more .. gain freedom from the shackles of the norm .. artificial intelligence is how we fight back aitx,23
2021-01-29,02:45:52,any intel on rh restrictions for gme ?,8
2021-01-29,00:56:22,i can barely even spell intellygent,6
2021-01-28,23:53:50,can this be done to intc ?,7
2021-01-28,21:19:27,"watching the corruption of trading platforms today , i decided to do some learning instead of trading . i came across this passage in the intelligent investor by benjamin graham ( an old legend in the stock world ). it ' s a message from the master : we decide when we ' re satisfied . hold the line .",60
2021-01-28,21:06:54,""" the intelligent investor "" is the current # 1 in the deals in books list on amazon lmao ( best sellers rank : # 23 in books )",29
2021-01-28,19:54:26,"gamers unite ! if we invest in $ amd , $ intc and $ nvidia they ' ll produce more gpus / cpus !",24
2021-01-28,17:17:07,i know everybody is  but why is amd going down ?? good q1 and beating intels ass !,19
2021-01-28,17:08:31,"when reeeeeee and muhhhhhh unite , the hedgies can ' t repel intellectual disability of this magnitude . even rockets built by morons can still fly !!",27
2021-01-28,16:39:14,must asset management inc just sold 3 . 3m shares of gme .,13
2021-01-28,16:15:19,check $ intc big short interet,6
2021-01-28,15:48:34,intel to the moon ???,5
2021-01-28,15:34:35,intel has been undervalued,4
2021-01-28,14:17:56,intc - ceo buys more shares,6
2021-01-28,13:20:00,gme shares to short 01 / 28 ( fintel ),10
2021-01-28,11:05:59,"fu *** intelligent investors , today i am gonna diversify with amc .",13
2021-01-28,09:34:31,any way to get intel on the current short interest as of today ?,14
2021-01-28,07:46:41,nakd the next gme ?,5
2021-01-28,07:18:41,i bought a 5900x from amd and im using it to buy intel stock because rocket - lake has a  in it . am i doing this right,29
2021-01-28,07:14:09,i bought a 5900x and used it in my pc to buy intel because rocket - lake has  in it and i heard those were good am i doing this right,32
2021-01-28,04:48:37,chamath and this reddit group has inspired me to liquidate all my winning positions and go long in gme tomorrow . i started my investing journey back in september with the intelligent investor . graham was a retard right ?,40
2021-01-28,02:27:13,from bay to wall : papa chen will await your arrival from valhalla . you sell when the squeeze is squoze my intellectually impeded friends . no sooner .,29
2021-01-28,01:29:44,can the most intelligent person in the room please explain this to me ?,14
2021-01-27,20:52:28,the sec can kiss my brown ass and biden can sniff it when they ' re done . investigating this sub for intelligently speculating against a hedgefund with questionable morality on a knucklehead trade is absurd .,37
2021-01-27,20:06:48,guess the intelligent investor is not worth reading anymore ? why do i have to have atleast 102 characters in the title ?,23
2021-01-27,20:02:01,i have super secret intel from a hedge fund that theyre gonna short bitcoin ... do you worst please ! :),21
2021-01-27,19:55:16,"aitx  robotics company focused on artificial intelligence , heavily shorted and ceo is posting an announcement at the end of the week . to the moon !",28
