date,time,processed,word_count
2021-01-27,19:48:45,i read this book called the intelligent investor that basically says buy and hold . it was written buy a well established investor,23
2021-01-27,19:45:44,"average intelligence of a wsb visitor these days is cratering to zero , buy gme and bb before these idiots realize whats happening",23
2021-01-27,19:36:57,19yr old needs help ? a small discussion w / advice from a bunch of intellects and degenerates .  $ gme $ nok $ amc $ bb,28
2021-01-27,19:11:26,"stpk : a pure energy play . buy the dip see you at 100 per share  compelling artificial intelligence for battery / energy management , in the era of the biden green new deal",35
2021-01-27,19:09:55,"hey , i ' m looking for a stock screener , which is the best according to you ? gurufocus , fintel , or something others ?",27
2021-01-27,17:56:42,intel going bullish this week,5
2021-01-27,17:27:03,cnbc is the fucking enemy ! they are discrediting our intelligence .,12
2021-01-27,17:18:13,"chamath palihapitiya is really standing up for wallstreetbets right now on cbs while the host continues to insult the intelligence of the community without meaning to "" insult "" their intelligence .",32
2021-01-27,16:19:16,lets get intel to 65,5
2021-01-27,15:58:42,bb short interest from fintel,5
2021-01-27,15:57:43,prkr is popping again - favorable ruling against intc in texas,11
2021-01-27,15:55:35,according to the most intelligent financial genius there is !,10
2021-01-27,15:54:46,everyone has calls against intel this week .. lets get it up a few bucks and make bank !!!!,19
2021-01-26,16:15:20,"benjamin ( boomer ) graham saying that you have to be a retard to reach the moon on "" the intelligent investor "".",23
2021-01-26,03:47:17,wsb receives intel that short interest has significantly increased on bb today,12
2021-01-26,03:27:36,buying intc cheap call cheap call cheap call all in,10
2021-01-25,15:13:02,"the name of the company , blackberry . it is a cutting edge intelligent security software company out of waterloo , canada awaiting imminent patent approval on the next generation of 5g smartphone devices that have both huge military and civilian applications now",43
2021-01-24,23:25:05,intc - the next gme ? hedge funds ' favorite short,11
2021-01-24,20:18:35,intc - the next hedge fund favorite short squeeze ?,10
2021-01-24,19:57:18,"$ intc ceo "" turnaround story "" - the next hedge fund short squeeze ?",15
2021-01-24,17:18:08,$ bb - market wire - the best artificial intelligence stocks to buy in 2021,15
2021-01-24,17:09:42,$ bb - the best artificial intelligence stocks to buy in 2021,12
2021-01-24,13:09:33,is intel a buy rn ?,6
2021-01-24,02:51:39,my intel calls made me miss out on an extra 20k in gme profits . switching to stocks monday premarket . afterburners engaged,23
2021-01-24,00:38:49,evolution of investing intelligence,4
2021-01-23,19:22:39,"wsb , you have taught me over the past year that being an autistic retarded sob is way better than being an intellectual . i wish i had listened a year ago when i busted my entire account . thank you ! let ' s keep the  fueled up and moving !",53
2021-01-23,12:00:22,"buy intel , china will invade taiwan , rip amd",10
2021-01-23,03:15:47,amd is going to pump heading to earnings and after earnings ! lots of shorts going to be squeezed next week !  intc down 8 . 5 % today . amd was green off intel ' s earnings report !! see you on the moon folks !!,48
2021-01-22,19:20:03,gme shares to short from fintel .,7
2021-01-22,14:49:10,stoopid / intelligent idea because i love america ?,9
2021-01-22,13:38:33,$ gme and my emotional intelligence,6
2021-01-22,06:55:47,[ paper hands ] just started options trading this week .. sold my intel calls on wednesday instead of thursday .,21
2021-01-22,04:36:14,should sec investigate intc for leaking earnings,7
2021-01-22,01:25:13,intel stock rises 6 % after leak about earnings was announced .,12
2021-01-22,01:20:10,intel puts printing tomorrow ?,5
2021-01-22,00:09:21,intel destroyed me . i am waking up a disaster in my portfolio ! any opinions on what i should do with this option and or my life ?,29
2021-01-22,00:09:00,my riskiest bet . # intc update 2021 / 01 / 21,12
2021-01-21,23:37:53,amd gonna print : intel said strength in pc sales helped it exceed its own expectations,16
2021-01-21,23:35:45,intel 7nm delayed to 2023 .,6
2021-01-21,22:48:07,why do they put this as the headline on intc after it dropped ?,14
2021-01-21,22:12:54,"so much for "" sell the news "" $ intc",10
2021-01-21,21:41:50,loaded up on intel puts expiring tommrow,7
2021-01-21,21:19:03,change in leadership . get on the intel train . choo choo .,13
2021-01-21,21:08:41,to whoever did the dd on intc a little while ago - thank you,14
2021-01-21,20:51:20,intel to the moon,4
2021-01-21,20:49:05,sell intc or go bankrupt,5
2021-01-21,16:13:19,thoughts : short intc 57p 1 / 22,8
2021-01-21,09:30:57,"intc er is today , boomer stock",7
2021-01-21,08:06:49,"selling my shares of amd and buying 300 in intc . hopefully earnings are good tomorrow , brothers .",19
2021-01-21,00:09:11,former pltr ' consultant ' avril haines about to be confirmed as director of nat . intelligence .,18
2021-01-21,00:07:08,$ trit doubling tripling in price soon retards better get in trading at 52 week low stock likes to move fintch and blockchain is the future mfs 50 shares and 2 12 . 5 121 days out calls to start full yolo baby,43
2021-01-20,23:21:36,calling all intelli - tards to explain something to the rest of us .,14
2021-01-20,22:44:26,yo netflix got me all fucked up in a good way and now im off to the intel earns okay bby lets go,23
2021-01-20,16:46:04,"dd : intel is outsourcing to tsmc , amd is going to crash hard",14
2021-01-20,15:44:12,$ amzn and $ bb  join forces to accelerate innovation with new intelligent vehicle data platform ( and take $ bb to the moon ),26
2021-01-20,09:47:03,"alaska sells intel , gilead , and qualcomm to buy more tesla stocks . soon we are on the mars",20
2021-01-19,20:40:38,td ameritrade lacks autistic inteligence ..... cant stop the $ bb raging boner,13
2021-01-19,15:47:41,is no one talking about txrc and its approval for intelligent surgical unit today ?? i can see it hitting the 20s by next year,25
2021-01-19,15:13:40,avinger expands intellectual property portfolio with another 19 patents,9
2021-01-19,12:42:16,transenterix soars as its intelligent surgical unit wins european nod (+ 41 % premarket ),15
2021-01-18,19:15:55,"amd set to dwarf intel , smash competition",8
2021-01-18,16:56:28,intel looks like a rocket ready for lift off ! to the moon !,14
2021-01-15,04:52:56,"fellow autists !!! when are we going to discuss making gain porn against intel ! after they lost theyre entire clientele , which was only 2 to begin with , gain porn against intel to the moon",37
2021-01-15,02:29:08,the argument against intel ' s ( intl ) new ceo [ amd ],14
2021-01-14,20:56:46,you guys called it . intel just ousted their ceo after years of running the country into the ground . he lost them 60 billion last year alone .,29
2021-01-14,17:47:34,thank you $ intc for getting me back to even,10
2021-01-14,13:48:51,when you post dd about intc calls months in advance of a move but people only care about meme stonks,20
2021-01-14,12:54:01,"stock market news for today | gme squeeze | baba , intc , tgt , afrm and other stock market news [ 01 - 14 ]",26
2021-01-13,22:43:21,intc  we did it bois !,7
2021-01-13,18:51:49,"ive only traded options once before i had intel calls , i dont even trade options but i had to buy a put on gme today after seeing it run so far . made $ 60 .",37
2021-01-13,15:18:48,my riskiest bet . # intc,6
2021-01-13,14:18:41,"intel ( intc ) ceo bob swan to step down in february , vmware ceo pat gelsinger to replace him",20
2021-01-13,14:14:59,"pat gelsinger to become intel ceo , up 12 % pm",11
2021-01-13,00:37:29,highly intelligent analyst sets $ 30 price target on $ bbby,11
2021-01-12,15:59:12,$ intc firing bob swan ; dick and balls bull flag,11
2021-01-12,06:02:36,""" army selects palantir , raytheon to support development of titan intelligence system """,14
2021-01-11,07:41:34,intellia therapeutics a cheap crispr therapeutics ?,7
2021-01-08,17:07:39,looking to find intelligence in a sea of autism,9
2021-01-06,23:20:56,artificial intelligence technology solutions $ aitx,6
2021-01-05,00:35:34,shorting intel ( dd ),5
2021-01-04,07:44:25,( lost 12k ) made a lot of money from listening to you fine intelligent folks ( was up 10k ). then tried options on mrna and airline stocks which blew my portfolio worse than having covid diarrhea . gonna convert to scientology to make these calls hit . lmk ur plays . god speed u autists .,58
2020-12-31,15:17:44,intel lets see how it will work out .. bought $ 52 . 50 strike jan 15 calls . executed at $ 0 . 31 .,26
2020-12-30,22:20:59,help on intel ?,4
2020-12-30,13:40:50,"stock market news for today | intc , pton , aapl , hd , lulu and other stock market updates [ 12 - 30 ]",25
2020-12-30,13:39:48,"stock market news for today | intc , pton , aapl , hd , lulu , amc and other stock market updates [ 12 - 30 ]",27
2020-12-30,03:18:48,intel to the moon ?,5
2020-12-30,02:42:44,intel giving me another week of gambling money,8
2020-12-29,17:42:56,"whys intel up all the sudden ? i was down like 30 % today and set an order to sell when it was around 1 . 12 and couple seconds later , contract executes .",35
2020-12-29,17:40:04,intc to the moon !,5
2020-12-29,17:35:30,any news on intc ? it mooned $ 3 in 10 minutes what is going on,16
2020-12-28,22:51:22,a question for the intelligent minds of wsb,8
2020-12-28,15:47:58,needed some got damn intelligence around here,7
2020-12-27,00:59:32,i just learnt what delta means . am i too intelligent to hang out with you retards ?,18
2020-12-26,01:15:46,discussion between two intellectuals,4
2020-12-24,12:02:43,intel and kfc announce a console that warms chicken .... tendies for everyone .,14
2020-12-23,16:53:32,i put this intel graph next to a mountain . new price target $ 8000,15
2020-12-22,17:40:12,doubled my 15k trading intelligently over 3 weeks . yolod it all on tsla calls . fuck me,18
2020-12-21,22:51:50,"after msft announced to move on their own chips , i went to do ta on intc",17
2020-12-21,18:55:24,exro validates intelligent battery technology for second life applications  pr newswire,12
2020-12-21,00:34:28,why is intel falling ?,5
2020-12-20,17:00:25,"our intelligence modifier is - 15 . roll two d20 while thinking about what calls youre going to make . if you crit , yolo calls , if you critically miss , yolo puts , if you roll 10 or more you stick to your trading strat . if you roll 9 or less , you choose a different stonk . this is new op trading strat",67
2020-12-19,16:19:06,"amd sold over 35 , 000 ryzen 5000 and ryzen 3000 cpus while intel only sold 5000 10th / 9th gen cpus in november at mindfactory",26
2020-12-18,21:35:23,"intel shits the bed again , no surprise",8
2020-12-18,21:30:39,short $ intc monday,4
2020-12-18,21:00:11,$ intc tanking today,4
2020-12-17,15:35:25,why i am bullish on intc,6
2020-12-10,07:17:57,"alright fellow intellects , i need your guidance .",9
2020-12-09,16:02:56,"the "" intelligent "" "" investor "" by benjamin graham",10
2020-12-08,20:44:25,"getting a pair of apple headphones from some $ tsla and $ pltr tendies . i wanna pay tribute to this sub , need the intellectuals ( or retards ) to decide the name .",35
2020-12-08,20:35:21,intc ( intel ) switching to team ( atlassian ) from avgo ( broadcom ' s rally ),18
2020-12-07,20:46:04,intel is fucked # 2,5
2020-12-06,16:51:37,$ intc 55 calls at 60 for 1 / 15 / 2021 . do you all think it will continue to run ? it ' s been steadily going up .,31
2020-12-06,15:33:46,50k profit off our overlord $ intc ** crayons applied for the autist **,14
2020-12-06,15:22:49,50k profit off our overload $ intc,7
2020-12-05,17:30:20,boomer gains : $ 47 . 7k profit on intel calls .,12
2020-12-04,19:22:31,will amd attract investors away from nvda like with intc ?,11
2020-12-03,03:38:39,reads the intelligent investor $ ual,6
2020-12-02,19:08:16,intel core i9 - 10900kf desktop processor 10 cores up to 5 . 3 ghz unlocked without processor graphics lga1200 ( intel 400 series chipset ) 125w,27
2020-12-02,17:48:07,intel bitches - also fuck penny stocks,7
2020-12-02,13:06:19,"apple 13in macbook air , 1 . 8ghz intel core i5 dual core processor , 8gb ram , 128gb ssd , mac os , silver , mqd32ll / a ( newest version ) ( renewed )",36
2020-12-01,19:53:50,""" ryan is a very intelligent man , and i remain as bullish as ever on gamestop ' s future ."" - nov 30 / 2020",26
2020-12-01,14:46:42,amazon and blackberry deal for intelligent vehicle platform . bb still under $ 10,14
2020-12-01,04:09:24,the new director of intelligence has some interesting private sector employment history .,13
2020-11-29,20:31:59,"are / r / wsb readers intelligent traders , or is gain porn a result of a million monkeys at a million typewriters ? take the survey .",28
2020-11-28,05:25:11,"finvolution - insane fundamentals , big data , artificial intelligence $ 2 . 23 / share",16
2020-11-27,23:40:04,biden appointing former pltr consultant avril haines to director of national intelligence,12
2020-11-27,20:11:21,pltr to the moon . are you forgetting that the next director of national intelligence was a former pltr employee ?,21
2020-11-26,23:20:19,"of 10 years of trading stocks , learning from the intelligent investor and warren buffet , i finally found out that imma retard . but retard has retard strength . here is my amd gains lol .",37
2020-11-26,16:11:37,"listen up retards , id like to give one of you a once in lifetime chance at landing a sexy intelligent wife ( without a boyfriend )",27
2020-11-26,04:20:56,buy pltr . our next director of national intelligence worked for pltr . holy mother of god . i know its old but it dropped when we didnt know biden winning .,32
2020-11-25,18:08:04,"me , an intellectual , investing in fisker so i can watch people panic when the palantir pump and dump is finished .",23
2020-11-24,09:55:49,director of national intelligence used to work at palantir .,10
2020-11-24,04:13:50,"sold uber to buy intc , ama",7
2020-11-23,18:55:30,biden picks avril haines as director of national intelligence ( former palantir consultant ),14
2020-11-20,15:28:08,the amd xilinx acquisition is the roadmap - high - end market transitioning to arm = amd stealing more intel market share,22
2020-11-12,19:24:12,"loop insights to launch uklipz , first ever artificial intelligence verified mobile video review platform for consumers and brands",19
2020-11-11,08:17:21,intel puts at open,4
2020-11-11,06:21:10,"$ aapl unveils m1 , $ intc is toast",9
2020-11-11,04:43:09,intel has x86 problems but arm ain ' t one ?,11
2020-11-10,17:12:07,cup and handle on intc,5
2020-11-02,19:44:48,intc puts for apple event ????,6
2020-10-30,13:36:38,intc big jump today ?,5
2020-10-29,03:53:30,"what is the lowest intc may go , buy / sell ?",12
2020-10-29,01:20:22,went full retard and got intel calls post earnings,9
2020-10-27,18:54:41,pick up intel 45c for cheap,6
2020-10-27,01:14:22,"amd earnings tomorrow , puts on intel ?",8
2020-10-26,18:09:09,puts on intel ! wish my ass luck ...,9
2020-10-25,19:56:19,invest in intel ??,4
2020-10-25,02:24:23,any getting buying into mark ? apparently intel might be buying them .,13
2020-10-24,09:51:18,rip intel bullish plays,4
2020-10-24,03:56:57,is intel really about to let themselves become kodak,9
2020-10-24,00:15:27,after yesterday ' s intel earnings call ... ( fixed my autism ),13
2020-10-23,23:11:50,after intel ' s earnings call yesterday ...,8
2020-10-23,21:11:59,intc did it again,4
2020-10-23,18:22:50,live look at intc ' s vitals,7
2020-10-23,15:06:33,puts on intel bob swan ( intel ceo ) cant even spell his name right,15
2020-10-23,14:37:39,intel  gains . bless lisa su .,8
2020-10-23,08:09:51,intel needs to shutdown their useless fabs and begin to order chips from tsm to beat amd like a pussy,20
2020-10-22,20:21:28,intc earnings are out !,5
2020-10-22,20:17:44,intel afterhours - down 10 % - what gives ?,10
2020-10-22,20:13:22,"my first options trade , just spare change . thought intel would tank , it did . did i do it right ? eli5 ? do your worst .",29
2020-10-22,18:32:44,thoughts on intc earnings ?,5
2020-10-22,14:35:53,back at it again gambling my tuition money . thoughts bruhs ??? intc to the moon,16
2020-10-22,13:48:33,"earnings after market intc , ehth , nkla",8
2020-10-21,23:13:31,"what do you guys think about intel , $ 57c and 59c 10 / 23",15
2020-10-21,16:52:36,"so lets say , hypothetically , that i throw 600 dollars to buy some intel stocks today for the 3q tomorrow and , for the sake of the question , if i dont die by tomorrow , will intel make a profit and give me money ?",47
2020-10-21,15:41:59,$ amd calls after $ intc earnings miss,8
2020-10-21,01:23:39,yolo on intel lfg baby 63c 10 / 23,9
2020-10-21,00:22:44,will intel go up or down,6
2020-10-16,14:40:19,monster trend on intc !,5
2020-10-14,00:05:03,my friend has 100 % of his portfolio in intc calls and shares,13
2020-10-13,05:36:42,"calls on aapl , puts on intc .",8
2020-10-12,19:05:29,intc gap fill starting ( buy calls if you have a small c0ck ),14
2020-10-11,19:52:16,you can all suck my dick . my all in intc calls are going to make me a wsb gain legend . fuck you gay bears . position : 58 . 5 10 / 30 calls + 120,38
2020-10-11,05:37:44,re : come on intc position,6
2020-10-11,05:31:07,ride $ intc to mount tendie !,7
2020-10-10,01:36:35,intc the 2 ton gorilla,5
2020-10-10,01:17:03,amd is really trying to stick it to intel  leofinance,11
2020-10-09,02:25:00,$ amd was always faster than intel cpu .,9
2020-10-08,16:51:20,puts on intc ?,4
2020-10-08,09:06:30,you better get me some shekels intel,7
2020-10-08,09:03:42,you better treat me right intel,6
2020-10-07,18:26:01,intel 53 put 10 / 16,6
2020-10-05,18:55:22,"going all in on intc when my student loan comes in , whos with me ?",16
2020-10-02,03:04:18,intel is signaling the apocalypse . calls on dooms day bunkers,11
2020-09-30,18:35:55,"here we go again .. msft calls , appl , intc , and crm",14
2020-09-29,05:27:45,"amd "" 7 nm "" transistors proven to be same size as intel 14 nm process",16
2020-09-29,05:20:32,"amd "" 7 nm "" transistors are literally the same size as intel 14 nm transistors ( some guy just posted video of electron microscope proof )",27
2020-09-27,15:07:40,intel in worse trouble than we thought ?,8
2020-09-24,17:45:50,what garbage am i reading ? are you calling me stupid ? an excerpt from the intelligent investor .,19
2020-09-24,03:22:45,intel received permission to supply huawei,6
2020-09-23,18:32:44,"amd , intel , or unity",6
2020-09-23,16:05:42,"$ intc , is it dead ?",7
2020-09-22,18:26:02,"what r ya thoughts bout raytheon ? conflict between usa / taiwan and china . a reason to buy ? a cold war ? will there be a market or a tech crash ? all tech companies produce in taiwan . apple , amd , intel , nvidia , tsm ...",51
2020-09-20,22:57:54,"amd and the 150b question , an in - depth look of amd vs intel ( part 2 )",19
2020-09-17,16:03:11,latest pcworld benchmark : intel tiger lake vs amd,9
2020-09-17,15:01:16,a new trader ' s dd on nvda vs intc,10
2020-09-15,17:34:49,i ' m still making money on slv and intc calls !,12
2020-09-14,20:57:34,how intellectuals properly invest in for their retirement,8
2020-09-14,20:40:01,i love that whooshing sound intc calls make as they go down the drain ...,15
2020-09-14,03:04:52,should i sell my intc call and put for extreme fedex otm calls ?,14
2020-09-12,04:14:45,"i ' m having trouble sifting through shitposts . is there a way to see only educational , intelligent posts ?",21
2020-09-11,18:41:14,dell ( dell ) and intel ( intc ) backing iabras virolens 20 second covid - 19 test,18
2020-09-10,12:08:11,read ' the intelligent investor ' and sold my portfolio,10
2020-09-10,05:12:06,bull case for intc,4
2020-09-08,15:25:28,intelsat is not mooning but is still better than spacex,10
2020-09-08,06:30:28,amd or intc ?,4
2020-09-08,05:44:46,"amd or intc ? obviously both you simple minded mouth breathers . dropped about 6k during the dip , mostly in amd .",23
2020-09-07,05:44:09,amd will  because of intel ' s presentation,9
2020-09-06,18:47:59,intel : the big picture and why i ' m bullish on it,13
2020-09-05,21:24:52,if smic gets banned . does intel and tsm moon ?,11
2020-09-04,16:24:40,# 86 : benjamin graham ' s the intelligent investor part 1,12
2020-09-03,18:21:16,now its the time for $ intc,7
2020-09-02,21:26:48,what do you think of fintel which tracks institutional buyers and their shares ?,14
2020-09-02,21:20:54,anyone profit on calls today for intel ?,8
2020-09-02,19:12:32,intc garbage . amd to the moon .,8
2020-09-02,18:55:23,intc gang wya ? intc 9 / 18 50c 56c,10
2020-09-02,18:54:09,wheres intc gang ? intc 9 / 18 50c and 9 / 18 56c,14
2020-09-02,15:53:25,intel event in 10min,4
2020-09-02,15:39:06,intel gang ~ to $ 60,6
2020-09-02,15:35:28,intel event in 30 mins,5
2020-09-01,20:58:13,intc will destroy amd / nvidia . septemer 2 2020 tigerlake release . intel to the moon,17
2020-09-01,17:46:00,8k intc yolo ; ~ 50 % of my savings,10
2020-09-01,02:51:08,intel gonna do shit in the next month ?,9
2020-08-31,21:04:58,"intel fanboys be like "" intel is much better than amd """,12
2020-08-31,20:50:10,so i read the intelligent investor,6
2020-08-31,20:23:01,intel smart play pt . 2,6
2020-08-31,18:04:38,i heard intel is doing something with tigers ? i love tigers,12
2020-08-31,18:03:15,"i heard intel is doing something with tigers ? sounds fuckin sweet . imagine like , a tiger powered computer . man i love calvin and hobbes .",28
2020-08-31,17:25:49,why ' s amd jumping 8 % a day before nvidia ' s big gpu and 2 days before intel ' s gpu and cpu announcement,26
2020-08-31,16:57:49,who else is playing intel calls this week ?,9
2020-08-31,16:48:37,4 . 6k intc yolo . lord be with me,10
2020-08-31,16:40:01,intc tendie train has left the station,7
2020-08-31,06:39:11,get ready for some trendies on intel,7
2020-08-30,21:05:47,follow up : smart money moving into intc - possible motivation ( 1 ),14
2020-08-30,16:21:23,seems smart money been buying up intel and been doing so exponentially .,13
2020-08-28,15:38:08,"amd founder once said real men have fabs , so puts on intc for being a real man",18
2020-08-27,15:27:32,first time investor seeking investment advice from this super intelligent group,11
2020-08-26,13:58:08,amd vs intc calls,4
2020-08-24,23:17:54,"i just spent ( bought high ) 50k on apple , nvdia , intel and amd . i am already down few %, am i stupid ?",27
2020-08-24,17:12:37,how stupid ( or intelligent ) is my tesla 2500 8 / 28 call ? am i going to get theta crushed ? or will papa elon take care of me again ?,33
2020-08-24,12:39:38,intel - why ?,4
2020-08-24,03:56:40,calling for intel bullssss !!!!,5
2020-08-22,18:19:00,intel on intel ( my dd ),7
2020-08-22,03:46:20,"decent month , rode the amd / ba / bac / intc trains",13
2020-08-21,18:27:48,am i the only retard that bought intel calls when they announced a buyback,14
2020-08-21,17:52:58,how a true intellectual ( autist ) decides where they should dump their money .,15
2020-08-21,04:52:02,your thoughts on intc,4
2020-08-20,12:40:55,intc $ 10b stock buyback,5
2020-08-20,12:37:41,thoughts on intc ' s $ 10b stock buyback ?,10
2020-08-20,12:36:47,what do you autists think about intc ' s $ 10b stock buyback ?,14
2020-08-20,12:15:55,30k intc yolo . hold or sell ?,8
2020-08-20,10:08:35,intc 30k yolo . am i toast ?,8
2020-08-20,09:24:46,30k yolo in intc . 50 % down . how fucked am i or will these recover ?,18
2020-08-20,02:55:42,intel ceo really out here reversing elons words for gains .,11
2020-08-20,02:19:03,intel too low imo,4
2020-08-20,01:31:30,"intel ayyyyyy , help a new retard gambler out understand typical buyback movements",13
2020-08-20,01:17:31,"new merger confirmed , $ intc to the moon",9
2020-08-20,01:16:03,intel options .... ayyyyy,4
2020-08-19,23:44:19,intc - time for a rebound,6
2020-08-19,22:39:10,intel and nvidia stonks moving almost inversely,7
2020-08-19,21:37:36,fuck all the intel haters -$ 10 billion accelerated share repurchase announced,12
2020-08-19,21:32:34,intc gang gang gang,4
2020-08-19,03:13:22,did you idiots buy the spce and intc dips ?,10
2020-08-18,18:50:51,""" why are my intel ics losing me so much money ? i called them perfectly ...""",17
2020-08-18,14:56:00,intellibed license revenue - anyone know intellibed sales ?,9
2020-08-17,16:50:15,so why is no one talking about intc ?,9
2020-08-17,16:09:15,intc buy the ( extremely credible ) rumor !,9
2020-08-17,00:32:39,conan shows us why $ intc is a garbage company,10
2020-08-17,00:28:16,conan shows us why $ intc is a garbage company destined for failure . i ' d rather jerk off my wife ' s boyfriend than work in those cubicles,30
2020-08-16,16:18:03,intel is a buy . short the tits out of amd / nvda .,14
2020-08-15,23:58:43,wsb vs . the intelligent investor,6
2020-08-15,02:35:46,new transistor technology boosts intels chip performance 20 %,9
2020-08-14,23:39:07,intc $ 49 put,4
2020-08-14,20:25:11,intel gaining steam and bound for a flip flop with amd,11
2020-08-14,20:17:05,buy intel while you can you fools,7
2020-08-14,12:54:52,play that funky music intc,5
2020-08-14,01:55:21,"intc calls !!! expire tm , who ' s with me !?!?",12
2020-08-14,00:59:18,f intel all my homies hate intel,7
2020-08-13,18:35:08,looks like intc isn ' t out of the fight . 49c 8 / 28,15
2020-08-13,07:24:13,intels new chipset announced,4
2020-08-12,22:58:10,intel ex - employee reveals insider details on company policies up to the 7 nm delays,16
2020-08-12,14:34:26,"am i the only one that thinks intel , intc , is mad underpriced right now ?",17
2020-08-11,22:51:57,$ intc in a nutshell,5
2020-08-09,21:39:55,intc is screwed even more . amd,7
2020-08-08,17:06:28,intel ceo bought $ 400k of intel stock and upcoming tiger lake,12
